{
  "$schema": "http://json-schema.org/draft-07/schema#",
  "title": "ProcessDefinitions",
  "type": "array",
  "items": {
    "type": "object",
    "properties": {
      "process_id": { "type": "string" },
      "process_name": { "type": "string" },
      "description": { "type": "string" },
      "version": { "type": "string" },
      "author": { "type": ["string", "null"] },
      "creation_date": { "type": ["string", "null"], "format": "date-time" },
      "last_modified": { "type": ["string", "null"], "format": "date-time" },
      "status": { "type": ["string", "null"] }
    },
    "required": ["process_id", "process_name", "description"]
  }
}